{
  "attempt_count": 19,
  "campaign_id": "wb-02-v1.7-2026-07-17",
  "evidence_count": 286,
  "failure_count": 0,
  "hardware": {
    "available_memory_mib": 10280.234375,
    "logical_cpus": 12,
    "machine": "Lenovo-PF4HMD0T",
    "npu": "Not collected",
    "platform": "Windows-10-10.0.26200-SP0",
    "processor": "Intel64 Family 6 Model 154 Stepping 3, GenuineIntel",
    "vulkan_sdk_version": "1.4.350.0"
  },
  "measurement_count": 76,
  "quality_count": 114,
  "repository": {
    "branch": "DETACHED",
    "commit": "519f0c594a8e31467d2e2f2cf17054c9e7e11536",
    "deviation_rows": [
      {
        "code": "UI-BUNDLE-MISSING",
        "deviation_id": "FAIL-AB-UI-ASSET",
        "evidence_ids": [
          "atomicbot-failure-register-175d58cb2e63e262"
        ],
        "nonterminal": true,
        "reason": "Generated UI embed target lacked loading.html",
        "scope_ids": [
          "AB-B02",
          "AB-B05"
        ],
        "scope_type": "setup",
        "status": "Resolved"
      },
      {
        "code": "DEVICE-GUARD-4551",
        "deviation_id": "FAIL-AB-DEVICE-GUARD",
        "evidence_ids": [
          "atomicbot-failure-register-175d58cb2e63e262"
        ],
        "nonterminal": true,
        "reason": "test-barrier.exe blocked at launch",
        "scope_ids": [
          "AB-B04"
        ],
        "scope_type": "setup",
        "status": "Open - external policy"
      },
      {
        "code": "MEMORY-GUARD",
        "deviation_id": "FAIL-AB-08Q-MEMORY",
        "evidence_ids": [
          "atomicbot-failure-register-175d58cb2e63e262"
        ],
        "nonterminal": true,
        "reason": "Initial batch reached 470.7 MiB free",
        "scope_ids": [
          "AB-08Q"
        ],
        "scope_type": "test",
        "status": "Resolved"
      },
      {
        "code": "SAFETY-GATE",
        "deviation_id": "FAIL-AB-8B-SAFETY",
        "evidence_ids": [
          "atomicbot-failure-register-175d58cb2e63e262"
        ],
        "nonterminal": true,
        "reason": "Initial preventive gate blocked high-risk 8B rows",
        "scope_ids": [
          "AB-KV8-F16-4K",
          "AB-15M"
        ],
        "scope_type": "multi-test",
        "status": "Resolved by controlled bypass"
      },
      {
        "code": "QUALITY-TIMEOUT-2400",
        "deviation_id": "FAIL-AB-P5-TIMEOUT",
        "evidence_ids": [
          "atomicbot-failure-register-175d58cb2e63e262"
        ],
        "nonterminal": true,
        "reason": "Turbo3 P5 returned no response within 2400 seconds",
        "scope_ids": [
          "P5",
          "AB-06"
        ],
        "scope_type": "mixed",
        "status": "Open"
      }
    ],
    "measurement_field_evidence": [
      {
        "evidence_ids": [
          "atomicbot-resource-e60f95d589aa1ab1",
          "EVID-34f5fdef9ec609afb3c6"
        ],
        "measurement_id": "MEAS-AB-01-R1",
        "measurement_kind": "resource-utilization",
        "supported_fields": [
          "latency_ms",
          "peak_working_set_bytes",
          "kv_cache_allocated_bytes",
          "cpu_utilization",
          "gpu_utilization"
        ],
        "test_case_id": "AB-01"
      },
      {
        "evidence_ids": [
          "atomicbot-resource-ee5dfe8604d350ee",
          "EVID-9e206b7341caf6ef1e4b"
        ],
        "measurement_id": "MEAS-AB-01-R2",
        "measurement_kind": "resource-utilization",
        "supported_fields": [
          "latency_ms",
          "peak_working_set_bytes",
          "kv_cache_allocated_bytes",
          "cpu_utilization",
          "gpu_utilization"
        ],
        "test_case_id": "AB-01"
      },
      {
        "evidence_ids": [
          "atomicbot-resource-eae7f7d1f9a690fe",
          "EVID-e0bc789317b1973f74b1"
        ],
        "measurement_id": "MEAS-AB-01-R3",
        "measurement_kind": "resource-utilization",
        "supported_fields": [
          "latency_ms",
          "peak_working_set_bytes",
          "kv_cache_allocated_bytes",
          "cpu_utilization",
          "gpu_utilization"
        ],
        "test_case_id": "AB-01"
      },
      {
        "evidence_ids": [
          "atomicbot-resource-873d9213f08c5c94",
          "EVID-e08341064813060e9c40"
        ],
        "measurement_id": "MEAS-AB-02-R1",
        "measurement_kind": "resource-utilization",
        "supported_fields": [
          "latency_ms",
          "peak_working_set_bytes",
          "kv_cache_allocated_bytes",
          "cpu_utilization",
          "gpu_utilization"
        ],
        "test_case_id": "AB-02"
      },
      {
        "evidence_ids": [
          "atomicbot-resource-65451b0ae8a00724",
          "EVID-d2af2834cb1723571844"
        ],
        "measurement_id": "MEAS-AB-02-R2",
        "measurement_kind": "resource-utilization",
        "supported_fields": [
          "latency_ms",
          "peak_working_set_bytes",
          "kv_cache_allocated_bytes",
          "cpu_utilization",
          "gpu_utilization"
        ],
        "test_case_id": "AB-02"
      },
      {
        "evidence_ids": [
          "atomicbot-resource-aeda0592516518c8",
          "EVID-a247b3a1bf624cb0be6d"
        ],
        "measurement_id": "MEAS-AB-02-R3",
        "measurement_kind": "resource-utilization",
        "supported_fields": [
          "latency_ms",
          "peak_working_set_bytes",
          "kv_cache_allocated_bytes",
          "cpu_utilization",
          "gpu_utilization"
        ],
        "test_case_id": "AB-02"
      },
      {
        "evidence_ids": [
          "atomicbot-resource-b7100238300b17fc",
          "EVID-43ddaeac46382db021c0"
        ],
        "measurement_id": "MEAS-AB-03-R1",
        "measurement_kind": "resource-utilization",
        "supported_fields": [
          "latency_ms",
          "peak_working_set_bytes",
          "kv_cache_allocated_bytes",
          "cpu_utilization",
          "gpu_utilization"
        ],
        "test_case_id": "AB-03"
      },
      {
        "evidence_ids": [
          "atomicbot-resource-32de32cbd9cfe78d",
          "EVID-96472d9159b64f3d0f65"
        ],
        "measurement_id": "MEAS-AB-03-R2",
        "measurement_kind": "resource-utilization",
        "supported_fields": [
          "latency_ms",
          "peak_working_set_bytes",
          "kv_cache_allocated_bytes",
          "cpu_utilization",
          "gpu_utilization"
        ],
        "test_case_id": "AB-03"
      },
      {
        "evidence_ids": [
          "atomicbot-resource-9ca9934bb9f1a5bb",
          "EVID-d2e75891fe506a3d775f"
        ],
        "measurement_id": "MEAS-AB-03-R3",
        "measurement_kind": "resource-utilization",
        "supported_fields": [
          "latency_ms",
          "peak_working_set_bytes",
          "kv_cache_allocated_bytes",
          "cpu_utilization",
          "gpu_utilization"
        ],
        "test_case_id": "AB-03"
      },
      {
        "evidence_ids": [
          "atomicbot-resource-110b5b282652658f",
          "EVID-efec9b2fed630bc079ad"
        ],
        "measurement_id": "MEAS-AB-KV3-F16-4K-R1",
        "measurement_kind": "resource-utilization",
        "supported_fields": [
          "latency_ms",
          "peak_working_set_bytes",
          "kv_cache_allocated_bytes",
          "cpu_utilization",
          "gpu_utilization"
        ],
        "test_case_id": "AB-KV3-F16-4K"
      },
      {
        "evidence_ids": [
          "atomicbot-resource-192efe0b319ec903",
          "EVID-35506717fa8f706ba6b9"
        ],
        "measurement_id": "MEAS-AB-KV3-F16-4K-R2",
        "measurement_kind": "resource-utilization",
        "supported_fields": [
          "latency_ms",
          "peak_working_set_bytes",
          "kv_cache_allocated_bytes",
          "cpu_utilization",
          "gpu_utilization"
        ],
        "test_case_id": "AB-KV3-F16-4K"
      },
      {
        "evidence_ids": [
          "atomicbot-resource-4c80f5cf8e86acab",
          "EVID-b900dc6046ab8890a097"
        ],
        "measurement_id": "MEAS-AB-KV3-F16-4K-R3",
        "measurement_kind": "resource-utilization",
        "supported_fields": [
          "latency_ms",
          "peak_working_set_bytes",
          "kv_cache_allocated_bytes",
          "cpu_utilization",
          "gpu_utilization"
        ],
        "test_case_id": "AB-KV3-F16-4K"
      },
      {
        "evidence_ids": [
          "atomicbot-resource-8544fc83416f82d6",
          "EVID-31f24bf0eb4821290fce"
        ],
        "measurement_id": "MEAS-AB-04-R1",
        "measurement_kind": "resource-utilization",
        "supported_fields": [
          "latency_ms",
          "peak_working_set_bytes",
          "kv_cache_allocated_bytes",
          "cpu_utilization",
          "gpu_utilization"
        ],
        "test_case_id": "AB-04"
      },
      {
        "evidence_ids": [
          "atomicbot-resource-d1e863c7f0eb6507",
          "EVID-e1d5edcc34b6df5a42c0"
        ],
        "measurement_id": "MEAS-AB-04-R2",
        "measurement_kind": "resource-utilization",
        "supported_fields": [
          "latency_ms",
          "peak_working_set_bytes",
          "kv_cache_allocated_bytes",
          "cpu_utilization",
          "gpu_utilization"
        ],
        "test_case_id": "AB-04"
      },
      {
        "evidence_ids": [
          "atomicbot-resource-1be858555d7e35c2",
          "EVID-4f346806f246152437a9"
        ],
        "measurement_id": "MEAS-AB-04-R3",
        "measurement_kind": "resource-utilization",
        "supported_fields": [
          "latency_ms",
          "peak_working_set_bytes",
          "kv_cache_allocated_bytes",
          "cpu_utilization",
          "gpu_utilization"
        ],
        "test_case_id": "AB-04"
      },
      {
        "evidence_ids": [
          "atomicbot-resource-852eaf84a4c065bc",
          "EVID-759c545f82837ae106dd"
        ],
        "measurement_id": "MEAS-AB-05-R1",
        "measurement_kind": "resource-utilization",
        "supported_fields": [